{
  "roleId": "forward-deployed-engineer",
  "displayName": "Forward Deployed Engineer",
  "aliases": [
    "FDE",
    "Forward Deployed Software Engineer",
    "Solutions Engineer"
  ],
  "levels": [
    "entry",
    "mid",
    "senior"
  ],
  "mission": "Solve ambiguous customer problems by combining software engineering, AI, integrations, deployment, communication, and operational ownership.",
  "requiredDomains": [
    "software engineering",
    "customer discovery",
    "integrations",
    "deployment",
    "debugging",
    "AI systems"
  ],
  "preferredDomains": [
    "cloud infrastructure",
    "data engineering",
    "security",
    "technical communication"
  ],
  "interviewEmphasis": [
    "coding",
    "system design",
    "customer scenarios",
    "ambiguity",
    "deployment",
    "stakeholder communication",
    "project ownership"
  ],
  "evaluationWeights": {
    "softwareEngineering": 0.2,
    "customerProblemSolving": 0.25,
    "deploymentAndIntegration": 0.2,
    "ownership": 0.2,
    "communication": 0.15
  },
  "minimumEvidence": [
    "end-to-end delivery",
    "ambiguous requirement handling",
    "integration evidence",
    "stakeholder communication"
  ],
  "truthRisks": [
    "inventing customer interaction",
    "overstating deployment ownership",
    "ignoring adoption and operational constraints"
  ]
}
